{"conditioning":{"skillBucket":"1200-1400","timeControlClass":"blitz","timePressureBucket":"NORMAL"},"hdi":{"components":{"entropy":2.937438536316381,"topGap":0.09000099399588482,"wdlSensitivity":0.006000066266392323},"value":1.4497751362077047},"humanWDL":{"postByMove":{"a2a3":{"d":0.2,"l":0.6060000662663925,"w":0.19399993373360763},"a2a4":{"d":0.2,"l":0.6042000463864747,"w":0.19579995361352534},"b1a3":{"d":0.2,"l":0.6029400324705323,"w":0.19705996752946772},"b1c3":{"d":0.2,"l":0.6020580227293726,"w":0.1979419772706274},"b2b3":{"d":0.2,"l":0.6014406159105607,"w":0.19855938408943916}},"pre":{"d":0.2,"l":0.6000000000000001,"w":0.19999999999999996}},"meta":{"generatedAt":"2024-01-01T12:00:00","inputHash":"ea4ad16ccf68a460ec2f169ebb36cc8fff6cd3ad98024ec2f06ff7e1f8b05bd1","schemaVersion":"v1"},"narrativeSeeds":[{"facts":["Top-3 moves have near-equal probability (gap=0.090)"],"severity":"medium","type":"confusing"},{"facts":["High Human Difficulty Index (1.45) indicates critical position"],"severity":"high","type":"critical"}],"policy":{"entropy":2.937438536316381,"topGap":0.09000099399588482,"topMoves":[{"p":0.300003313319616,"san":null,"uci":"a2a3"},{"p":0.21000231932373117,"san":null,"uci":"a2a4"},{"p":0.1470016235266118,"san":null,"uci":"b1a3"},{"p":0.10290113646862827,"san":null,"uci":"b1c3"},{"p":0.07203079552803979,"san":null,"uci":"b2b3"},{"p":0.05042155686962784,"san":null,"uci":"b2b4"},{"p":0.03529508980873949,"san":null,"uci":"b5a4"},{"p":0.02470656286611764,"san":null,"uci":"b5a6"},{"p":0.017294594006282346,"san":null,"uci":"b5c4"},{"p":0.012106215804397642,"san":null,"uci":"b5c6"},{"p":0.008474351063078348,"san":null,"uci":"b5d3"},{"p":0.005932045744154844,"san":null,"uci":"b5e2"},{"p":0.004152432020908391,"san":null,"uci":"b5f1"},{"p":0.002906702414635873,"san":null,"uci":"c2c3"},{"p":0.002034691690245111,"san":null,"uci":"c2c4"},{"p":0.0014242841831715778,"san":null,"uci":"d1e2"},{"p":0.0009969989282201043,"san":null,"uci":"d2d3"},{"p":0.0006978992497540729,"san":null,"uci":"d2d4"},{"p":0.000488529474827851,"san":null,"uci":"e1e2"},{"p":0.0003419706323794957,"san":null,"uci":"e1f1"},{"p":0.00023937944266564696,"san":null,"uci":"e1g1"},{"p":0.00016756560986595288,"san":null,"uci":"f3d4"},{"p":0.00011729592690616701,"san":null,"uci":"f3e5"},{"p":8.21071488343169e-05,"san":null,"uci":"f3g1"},{"p":5.747500418402182e-05,"san":null,"uci":"f3g5"},{"p":4.0232502928815276e-05,"san":null,"uci":"f3h4"},{"p":2.8162752050170693e-05,"san":null,"uci":"g2g3"},{"p":1.9713926435119482e-05,"san":null,"uci":"g2g4"},{"p":1.3799748504583636e-05,"san":null,"uci":"h1f1"},{"p":9.659823953208546e-06,"san":null,"uci":"h1g1"},{"p":6.7618767672459814e-06,"san":null,"uci":"h2h3"},{"p":4.733313737072187e-06,"san":null,"uci":"h2h4"}]},"position":{"fen":"r1bqkbnr/1ppp1ppp/p1n5/1B2p3/4P3/5N2/PPPP1PPP/RNBQK2R w KQkq - 0 4","legalMoves":["a2a3","a2a4","b1a3","b1c3","b2b3","b2b4","b5a4","b5a6","b5c4","b5c6","b5d3","b5e2","b5f1","c2c3","c2c4","d1e2","d2d3","d2d4","e1e2","e1f1","e1g1","f3d4","f3e5","f3g1","f3g5","f3h4","g2g3","g2g4","h1f1","h1g1","h2h3","h2h4"],"sideToMove":"white"}}